<?xml version = "1.0"?>

<!DOCTYPE xmledi SYSTEM "xmledi.dtd">


<!-- revid is used to identify the xmledi rev in use here -->
<!-- xmledi doctype="214" revid="0.01" -->

<xmledi doctype="214" revid="0.01">

	<transmission>
		<sender>RDWY</sender>
		<receiver>DIGSHI</receiver>
		<date>2001-12-12</date>
		<time>15:45:05</time>
		<method>INTERNET</method>
	</transmission>

	<shipment pronum="21412414" bolnum="213902139" ponum="213-ASD=12">
		<location>
			<party type="origin">
				<name>ABC Company</name>
				<name>Shipping Dept</name>
				<address>1234 ABC Rd.</address>
				<address>Suite 563</address>
				<city>Chicago</city>
				<state>IL</state>
				<zip>60614</zip>
				<country>USA</country>
			</party>

			<party type="destination">
				<name>ABC Company</name>
				<name>Shipping Dept</name>
				<address>1234 ABC Rd.</address>
				<address>Suite 563</address>
				<city>Chicago</city>
				<state>IL</state>
				<zip>60614</zip>
				<country>USA</country>
			</party>

			<party type="billing">
				<name>ABC Company</name>
				<name>Shipping Dept</name>
				<address>1234 ABC Rd.</address>
				<address>Suite 563</address>
				<city>Chicago</city>
				<state>IL</state>
				<zip>60614</zip>
				<country>USA</country>
			</party>
		</location>

		<product>
			<description>Steel Wheels</description>
			<weight>10000</weight>
			<class>50</class>
			<units>10</units>
			<hazmat>N</hazmat>
		</product>

		<pickup>
			<pickupdate>2000-11-12</pickupdate>
			<pickupafter>05:00:00</pickupafter>
			<pickupbefore>16:00:00</pickupbefore>
		</pickup>

		<services>
			<type id="liftgate">Lift Gate</type>
			<type id="special">Another Special Service</type>
		</services>

	</shipment>

</xmledi>